{
  "schemaVersion": "agent-registry-entry.v1",
  "id": "knowledge.reviewer",
  "owner": {
    "team": "ai-knowledge",
    "contact": "knowledge-owner@example.invalid"
  },
  "purpose": "Defines the contract for a knowledge review agent entry without enabling runtime execution.",
  "version": "1.0.0",
  "status": "draft",
  "capabilities": [
    {
      "id": "knowledge-review",
      "description": "Reviews knowledge artifacts against ENTERPRISE-10-10 governance expectations."
    }
  ],
  "tools": [
    {
      "id": "repository-read",
      "permission": "read-only",
      "required": true
    }
  ],
  "evaluationSuite": {
    "id": "enterprise-10-10-agent-evaluation",
    "minimumScore": 0.8,
    "requiredBeforeActivation": true
  },
  "runtimeControls": {
    "toolUse": "declared-only",
    "dataBoundary": "internal",
    "humanApproval": "required-before-active"
  },
  "governance": {
    "roadmapTask": "W5-T1",
    "approvalState": "proposed",
    "changePolicy": "schema-review-required",
    "doesNotClose": ["W5-T2", "W5-T3", "W5-T4", "W5-T5", "W5-T6"]
  }
}
